{
  "$schema": "https://json-schema.org/draft/2020-12/schema",
  "$id": "https://diving-simulator.local/schemas/site-gameplay.json",
  "title": "Dive site gameplay resource",
  "description": "Renderer-neutral collision, air and spawn data. Nothing here describes how a site looks; art lives in the presentation resource and cannot reach these fields.",
  "type": "object",
  "additionalProperties": false,
  "required": ["schemaVersion", "kind", "sourceDigest", "generator", "sites"],
  "properties": {
    "schemaVersion": { "const": 1 },
    "kind": { "const": "diving-simulator-site-gameplay" },
    "sourceDigest": { "type": "string", "pattern": "^sha256:[0-9a-f]{64}$" },
    "generator": { "type": "string", "minLength": 1 },
    "sites": {
      "type": "object",
      "minProperties": 1,
      "additionalProperties": { "$ref": "#/$defs/site" }
    }
  },
  "$defs": {
    "entryPoint": {
      "description": "Where the diver enters the water. Gameplay data, so its type has to be pinned: `{ x: \"0\" }` would place a spawn at a string coordinate, and the parity suite does not compare entry points.",
      "type": "object",
      "additionalProperties": false,
      "required": ["x"],
      "properties": {
        "x": { "type": "number" }
      }
    },
    "profilePoint": {
      "type": "object",
      "additionalProperties": false,
      "required": ["x", "d"],
      "properties": {
        "x": { "type": "number" },
        "d": { "type": "number", "minimum": 0 }
      }
    },
    "profile": {
      "type": "array",
      "minItems": 2,
      "items": { "$ref": "#/$defs/profilePoint" }
    },
    "structure": {
      "type": "object",
      "required": ["x1", "x2", "dTop", "dBottom"],
      "properties": {
        "x1": { "type": "number" },
        "x2": { "type": "number" },
        "dTop": { "type": "number", "minimum": 0 },
        "dBottom": { "type": "number", "minimum": 0 },
        "kind": { "type": "string" }
      }
    },
    "badAirDome": {
      "type": "object",
      "required": ["x1", "x2"],
      "properties": {
        "x1": { "type": "number" },
        "x2": { "type": "number" },
        "d": { "type": "number", "minimum": 0 }
      }
    },
    "site": {
      "type": "object",
      "additionalProperties": false,
      "required": [
        "id",
        "maxDepth",
        "hasOverhead",
        "entry",
        "floor",
        "ceiling",
        "structures",
        "badAir"
      ],
      "properties": {
        "id": { "type": "string", "minLength": 1 },
        "maxDepth": { "type": "number", "exclusiveMinimum": 0 },
        "hasOverhead": { "type": "boolean" },
        "entry": { "$ref": "#/$defs/entryPoint" },
        "boatX": { "type": "number" },
        "floor": { "$ref": "#/$defs/profile" },
        "ceiling": {
          "description": "Overhead profile, or explicit null for open water. Required, and null must be spelled out: an absent field makes ceilingAt() fall through to 0, which turns the cave roof into open water (14 m becomes 0 m at x=50) and lets the diver swim up through it. Parity would not catch that, because legacy and generated data lose the field together and agree on 0.",
          "oneOf": [{ "$ref": "#/$defs/profile" }, { "type": "null" }]
        },
        "structures": {
          "type": "array",
          "items": { "$ref": "#/$defs/structure" }
        },
        "badAir": {
          "type": "array",
          "items": { "$ref": "#/$defs/badAirDome" }
        },
        "currentBias": { "type": "number", "minimum": 0 },
        "noShark": { "type": "boolean" }
      }
    }
  }
}
